{
  "id": "tolgshow-7827",
  "imdbId": "tt7827112",
  "manualEntry": false,
  "status": "ready",
  "createdAt": "2026-08-06T23:40:13.637Z",
  "updatedAt": "2026-08-07T09:11:00.000Z",
  "type": "series",
  "tmdbId": 76579,
  "title": "TOLGSHOW",
  "originalTitle": "TOLGSHOW",
  "overview": "Tolga Çevik’in merakla beklenen yeni programı TOLGSHOW yayına hazır! Doğaçlama sahnelediği ‘Arkadaşım’ karakteriyle 10 yıldır milyonları güldüren Tolga Çevik yeni programında sürpriz konuklar da ağırlayacak. ‘Gizemli Yönetmen’ Fırat Parlak ve ‘Minik Müzisyen’ Özer Atik’in de yer aldığı TOLGSHOW yine yanlış anlamalar, bilinmezlikler, didişmeler ve kahkahalar arasında geçecek.",
  "releaseYear": 2018,
  "genres": [
    "Komedi",
    "Talk"
  ],
  "posterUrl": "https://image.tmdb.org/t/p/w780/cpIuEqufA0efZ6mbB5GDMbifSzM.jpg",
  "backdropUrl": "https://image.tmdb.org/t/p/w1280/1vxXE7ZfKuXBP7FoPlDVJGKdegc.jpg",
  "cast": [
    {
      "name": "Tolga Çevik",
      "character": "Arkadaşım",
      "profileUrl": "https://image.tmdb.org/t/p/w300/btsEAsTYeMk5YSFy0br0u4y4GcL.jpg"
    },
    {
      "name": "Özer Atik",
      "character": "Minik",
      "profileUrl": "https://image.tmdb.org/t/p/w300/fXnAJxR7uZTHgVNeANsXpnyc00f.jpg"
    },
    {
      "name": "Fırat Parlak",
      "character": "Yönetmen",
      "profileUrl": "https://image.tmdb.org/t/p/w300/ebGjbXwfvgt08D5viQjG6B7iIhq.jpg"
    }
  ],
  "crew": [
    {
      "name": "Fırat Parlak",
      "job": "Writer",
      "profileUrl": "https://image.tmdb.org/t/p/w300/ebGjbXwfvgt08D5viQjG6B7iIhq.jpg"
    },
    {
      "name": "Tolga Çevik",
      "job": "Writer",
      "profileUrl": "https://image.tmdb.org/t/p/w300/btsEAsTYeMk5YSFy0br0u4y4GcL.jpg"
    }
  ],
  "seasons": [
    {
      "seasonNumber": 1,
      "name": "Sezon 1",
      "overview": "",
      "posterUrl": "https://image.tmdb.org/t/p/w780/mEd39AicKW5VotPTe4wM1jRvjJx.jpg",
      "episodes": [
        {
          "episodeNumber": 1,
          "title": "1. Bölüm",
          "overview": "",
          "airDate": "2018-01-01",
          "stillUrl": "https://image.tmdb.org/t/p/w500/ghVv9M63MqO1jNRebVWSKxWCfDf.jpg",
          "runtimeMinutes": 92,
          "status": "pending"
        },
        {
          "episodeNumber": 2,
          "title": "2. Bölüm",
          "overview": "",
          "status": "ready",
          "shardId": "mfilms12/film2-media-01",
          "asset": {
            "masterPlaylistUrl": "https://huggingface.co/datasets/mfilms12/film2-media-01/resolve/main/media/tolgshow-7827/s1e2/master.m3u8",
            "audioLanguages": [],
            "subtitleLanguages": []
          }
        }
      ]
    }
  ]
}
